{
  "case_id": "AMI-SYN-CLR-001",
  "case_name": "Routine Record with Documented Mitigation",
  "tenant_id": "AMIVERO-SYNTHETIC",
  "program_id": "AMILENS-DEMO",
  "subject": {
    "subject_id": "SUBJ-CLR-001",
    "display_name": "Dana Whitfield",
    "citizenship": ["United States"]
  },
  "case_context": {
    "person_status": "applicant",
    "service_type": "competitive_service",
    "position_title": "Financial Systems Administrator",
    "position_risk_level": "high_risk_public_trust",
    "position_sensitivity": "critical_sensitive",
    "piv_required": true,
    "conditional_offer_date": "2026-04-02T00:00:00Z",
    "agency_component": "SYNTHETIC-AGENCY"
  },
  "requested_analyses": ["suitability", "national_security_eligibility"],
  "policy_pack_ids": ["federal-core-2026-07-30", "sead4-current"],
  "document_expectations": [
    "security_questionnaire",
    "report_of_investigation",
    "subject_interview"
  ],
  "created_at": "2026-08-17T00:00:00Z",
  "created_by": "synthetic-fixture-builder"
}
